{
  "bosch_hale_dt": {
    "reactivity_m3_s": [
      1.253977699838354e-32,
      5.696570582973228e-29,
      6.85688424959328e-27,
      6.923062415028766e-26,
      2.977426340919893e-25,
      8.424870128324944e-25,
      1.866968479376403e-24,
      5.974472920887915e-24,
      1.3657833184867878e-23,
      2.5538034518523627e-23,
      4.179257587034642e-23,
      6.222385609317787e-23,
      8.636967284976203e-23,
      1.1361654705836232e-22,
      1.7474084712931176e-22,
      2.7399296107880726e-22,
      4.330201895538215e-22,
      6.680782799096394e-22,
      7.997634213159322e-22,
      8.64908494548689e-22,
      8.938335428607232e-22,
      8.837456001870975e-22,
      8.447662458665835e-22
    ],
    "temperature_kev": [
      0.2,
      0.5,
      1.0,
      1.5,
      2.0,
      2.5,
      3.0,
      4.0,
      5.0,
      6.0,
      7.0,
      8.0,
      9.0,
      10.0,
      12.0,
      15.0,
      20.0,
      30.0,
      40.0,
      50.0,
      70.0,
      80.0,
      100.0
    ]
  },
  "constants": {
    "alpha_mass_kg": 6.644657345e-27,
    "alpha_proton_mass_ratio": 3.972599690252,
    "deuteron_proton_mass_ratio": 1.9990075012699,
    "electron_mass_kg": 9.1093837139e-31,
    "elementary_charge_c": 1.602176634e-19,
    "proton_mass_kg": 1.67262192595e-27,
    "triton_proton_mass_ratio": 2.99371703403,
    "vacuum_permittivity_f_m": 8.8541878188e-12
  },
  "evans_stopping_partition": {
    "alpha_energy_mev": [
      2.5,
      1.5
    ],
    "equal_stopping_energy_mev": [
      2.2,
      4.3
    ],
    "equation_ion_fraction": [
      0.45220882851405086,
      0.8291655495984819
    ],
    "temperature_kev": [
      50.0,
      100.0
    ]
  },
  "nrl_bremsstrahlung": {
    "case_ids": [
      "pure-dt",
      "dt-plus-he-ash",
      "pure-h-like"
    ],
    "power_w_m-3": [
      20698.18832651786,
      39740.521586914285,
      21376.996982738245
    ]
  },
  "nrl_dt_equilibration": {
    "composition": {
      "deuterium_number_fraction": 0.5,
      "tritium_number_fraction": 0.5
    },
    "effective_mass_ratio": [
      2.3972733786507514,
      2.3972733786507514,
      2.3972733786507514
    ],
    "electron_density_m-3": 1e+20,
    "frequency_s-1": [
      62.42960611461575,
      6.191521112993216,
      1.2713839872052524
    ],
    "ln_lambda": [
      14.789659628023816,
      16.399097540457916,
      17.497709829126027
    ],
    "tau_delta_temperature_s": [
      0.008009020577224852,
      0.08075559961359495,
      0.3932722175454613
    ],
    "tau_e_equation_s": [
      0.016018041154449703,
      0.1615111992271899,
      0.7865444350909226
    ],
    "temperature_ev": [
      1000.0,
      5000.0,
      15000.0
    ]
  },
  "nrl_electron_collision": {
    "collision_time_s": [
      2.7519865499307637e-07,
      7.347656277029248e-06,
      0.00036079681029242466
    ],
    "electron_density_m-3": 1e+20,
    "frequency_s-1": [
      3633738.6896936637,
      136097.81980769424,
      2771.643128412092
    ],
    "ln_lambda": [
      12.487074535029771,
      14.789659628023816,
      17.497709829126027
    ],
    "temperature_ev": [
      100.0,
      1000.0,
      15000.0
    ]
  },
  "schema": "pvs-plasma-reference-values/3"
}
